{
  "schemaVersion": "1.0.0",
  "id": "agent-tool-server-ebay",
  "name": "eBay Agent Tool Server",
  "description": "A read-only server for retrieving, searching, and comparing eBay Browse API listings.",
  "version": "0.1.0",
  "lifecycle": "development",
  "repository": "https://github.com/ashergarland/agent-tool-server-ebay",
  "license": "MIT",
  "maintainer": "@ashergarland",
  "categories": ["commerce", "marketplaces"],
  "tags": ["ebay", "listings", "search"],
  "interfaces": {
    "transports": ["stdio", "openapi-http"],
    "hosting": "self-hosted",
    "endpoints": {
      "openApiUrlTemplate": "https://{host}/openapi.json",
      "healthUrlTemplate": "https://{host}/health"
    },
    "authentication": ["api-key", "bearer-token", "oauth2"],
    "requiredConfiguration": [
      {
        "name": "API_KEYS",
        "required": true,
        "secret": true,
        "description": "Inbound API keys when API-key authentication is selected."
      },
      {
        "name": "AUTH_MODE",
        "required": true,
        "secret": false,
        "description": "Selects API-key or local disabled authentication."
      },
      {
        "name": "EBAY_CLIENT_ID",
        "required": true,
        "secret": true,
        "description": "eBay application client identifier."
      },
      {
        "name": "EBAY_CLIENT_SECRET",
        "required": true,
        "secret": true,
        "description": "eBay application client secret."
      },
      {
        "name": "EBAY_ENVIRONMENT",
        "required": true,
        "secret": false,
        "description": "Selects the eBay production or sandbox environment."
      }
    ]
  },
  "capabilities": {
    "tools": [
      {
        "name": "ebay_get_listing",
        "summary": "Retrieve structured listing data from an eBay URL or item ID.",
        "safety": "low",
        "behavior": "read-only",
        "consequential": false,
        "availability": "available"
      },
      {
        "name": "ebay_search_listings",
        "summary": "Search active eBay listings with bounded filters.",
        "safety": "low",
        "behavior": "read-only",
        "consequential": false,
        "availability": "available"
      },
      {
        "name": "ebay_find_similar_listings",
        "summary": "Find active comparable listings using documented identifiers and keywords.",
        "safety": "low",
        "behavior": "read-only",
        "consequential": false,
        "availability": "available"
      },
      {
        "name": "ebay_compare_listings",
        "summary": "Compare active listings without making a recommendation.",
        "safety": "low",
        "behavior": "read-only",
        "consequential": false,
        "availability": "available"
      }
    ]
  },
  "operations": {
    "leastPrivilege": "not-documented",
    "scopeAllowLists": "not-documented",
    "mutationsDisabledByDefault": true,
    "explicitMutationConfirmation": "not-documented",
    "dryRun": "not-documented",
    "auditLogging": "not-documented",
    "credentialPersistence": "memory-only",
    "inputValidation": true,
    "outputValidation": true,
    "rateLimiting": true,
    "healthMonitoring": true
  },
  "provenance": {
    "sourceMetadata": {
      "kind": "readme",
      "location": "README.md"
    },
    "lastVerifiedCommit": "4ae9f531a15ef8de1c2763104f912214bfb8711d",
    "reviewStatus": "mismatch",
    "notes": [
      "The source repository does not yet contain the required server.json.",
      "The source package name, repository URL, README title, CI badge, service name, and security link still use the former chatgpt-ebay name.",
      "No published package, immutable container release, official MCP registration, Docker catalog registration, or stable hosted endpoint was verified."
    ]
  }
}
